{
  "scanId": "demo-studio-4b",
  "address": "Laurel Bend Apts #4B (demo)",
  "capturedAt": "2025-08-01T15:20:00-04:00",
  "tags": [
    {
      "id": 12,
      "room": "bedroom",
      "object": "carpet",
      "note": "dark stain near closet, ~8 in",
      "photo": "photos/room-bedroom-carpet.png",
      "box": [
        0.52,
        0.7,
        0.24,
        0.14
      ],
      "takenAt": "2025-08-01T15:31:00-04:00",
      "frame": "frame_00031",
      "position": [
        3.9,
        1,
        0.01
      ],
      "confirmed": false
    },
    {
      "id": 7,
      "room": "living room",
      "object": "wall",
      "note": "grey scuff by the door, ~10 in",
      "photo": "photos/room-livingroom-wall.png",
      "box": [
        0.33,
        0.4,
        0.16,
        0.06
      ],
      "takenAt": "2025-08-01T15:44:00-04:00",
      "frame": "frame_00044",
      "position": [
        1.98,
        -1.49,
        1
      ],
      "confirmed": false
    },
    {
      "id": 21,
      "room": "kitchen",
      "object": "counter",
      "note": "small burn mark near the stove",
      "photo": "photos/room-kitchen-counter.png",
      "box": [
        0.38,
        0.46,
        0.12,
        0.06
      ],
      "takenAt": "2025-08-01T15:52:00-04:00",
      "frame": "frame_00052",
      "position": [
        4.72,
        -0.55,
        0.9
      ],
      "confirmed": false
    },
    {
      "id": 3,
      "room": "bedroom",
      "object": "blinds",
      "note": "two bent slats",
      "photo": "photos/room-bedroom-blinds.png",
      "box": [
        0.38,
        0.28,
        0.24,
        0.12
      ],
      "takenAt": "2025-08-01T15:36:00-04:00",
      "frame": "frame_00036",
      "position": [
        0.42,
        0.2,
        1.7
      ],
      "confirmed": false
    }
  ]
}
